{
  "schemaVersion": "drama-studio/context-snapshot/v0",
  "snapshotId": "ctx-ep21-author-1",
  "createdFor": {
    "taskId": "task-ep21-draft",
    "workstation": "C5",
    "role": "author"
  },
  "projectBase": {
    "remoteProjectId": "proj-demo-0001",
    "sourceSnapshotId": "wsnap-77"
  },
  "budget": {
    "unit": "chars",
    "limit": 20000
  },
  "items": [
    {
      "ref": {
        "kind": "remote_page",
        "id": "page-ep21-outline",
        "revision": 2
      },
      "partition": "current_plan",
      "required": true,
      "usage": "project_text",
      "chars": 1800,
      "sha256": "sha256:aaaaaaaaaaaaaaaaaaaaaaaaaaaaaaaaaaaaaaaaaaaaaaaaaaaaaaaaaaaaaaaa",
      "reason": "本集要实现的选择与出口"
    },
    {
      "ref": {
        "kind": "remote_artifact",
        "id": "art-ep20-draft",
        "revision": 3,
        "range": {
          "start": 2400,
          "end": 5200
        }
      },
      "partition": "project_facts",
      "required": true,
      "usage": "project_text",
      "chars": 2800,
      "sha256": "sha256:aaaaaaaaaaaaaaaaaaaaaaaaaaaaaaaaaaaaaaaaaaaaaaaaaaaaaaaaaaaaaaaa",
      "reason": "前集结尾孩子失手的原场面（迁移前的历史候选，按 remote_artifact 只读引用）"
    },
    {
      "ref": {
        "kind": "knowledge_card",
        "id": "kc-apology-cost",
        "revision": 1
      },
      "partition": "knowledge",
      "required": false,
      "usage": "creative_reference",
      "chars": 400,
      "reason": "父亲道歉那场缺少可见代价"
    }
  ],
  "omitted": [
    {
      "ref": {
        "kind": "remote_artifact",
        "id": "art-ep05-draft",
        "revision": 1
      },
      "required": false,
      "reason": "not_relevant"
    }
  ],
  "completeness": "complete"
}
